{
  "route_version": "1.0",
  "route_id": "launch-readiness",
  "display_name": "Launch Readiness",
  "purpose": "Assemble one evidence-backed launch-readiness package across message, product flow, measurement, and optional channel capabilities without launching.",
  "activation": {
    "modes": ["required_by_objective", "activated_by_observed_trigger"],
    "objective_signals": ["The objective concerns launch readiness, release communication, acquisition readiness, or coordinated channel preparation."],
    "prerequisites": ["The launch objective and expected user path are defined; feedback-only and acquisition launches may use different gates."]
  },
  "context_requirements": ["facts", "prohibited_claims", "audience", "market", "funnel", "metrics", "channels", "authority"],
  "nodes": [
    {"node_id": "coordinate", "role_id": "growth-coordinator", "depends_on": [], "optional": false, "run_when": "always", "objective": "Define one launch goal, user path, scope, owners, readiness criteria, non-goals, and stop rule.", "output_contract": "result-envelope@2", "deliverable_contract": "task-set@1", "allowed_write_roots": ["handoffs", "records/decisions"]},
    {"node_id": "launch-evidence", "role_id": "evidence-research", "depends_on": ["coordinate"], "optional": false, "run_when": "always", "objective": "Collect current evidence about audience, alternatives, channel constraints, and launch risks.", "output_contract": "result-envelope@2", "deliverable_contract": "evidence-packet@1", "allowed_write_roots": ["evidence/packets", "handoffs"]},
    {"node_id": "product-readiness", "role_id": "growth-product-cro", "depends_on": ["coordinate"], "optional": false, "run_when": "always", "objective": "Assess whether the intended user path reaches the promised value and identify blocking funnel gaps.", "output_contract": "result-envelope@2", "deliverable_contract": "funnel-diagnosis@1", "allowed_write_roots": ["records/experiments", "handoffs"]},
    {"node_id": "measurement-readiness", "role_id": "analytics-experimentation", "depends_on": ["coordinate"], "optional": false, "run_when": "always", "objective": "Bind launch baseline, metrics, guardrails, window, coverage, and decision rule.", "output_contract": "result-envelope@2", "deliverable_contract": "measurement-plan@1", "allowed_write_roots": ["records/learning", "handoffs"]},
    {"node_id": "search-preflight", "role_id": "search-ai-discovery", "depends_on": ["launch-evidence"], "optional": true, "run_when": "Run when owned-web or search discovery is part of the launch motion.", "objective": "Prepare the technical and content discoverability preflight without changing or publishing the website.", "output_contract": "result-envelope@2", "deliverable_contract": "discovery-package@1", "allowed_write_roots": ["handoffs", "records/discovery"]},
    {"node_id": "lifecycle-preflight", "role_id": "lifecycle-crm", "depends_on": ["product-readiness", "measurement-readiness"], "optional": true, "run_when": "Run only when a consented lifecycle journey is part of the expected user path.", "objective": "Prepare a paused lifecycle journey with consent, suppression, frequency, and measurement checks.", "output_contract": "result-envelope@2", "deliverable_contract": "lifecycle-plan@1", "allowed_write_roots": ["handoffs", "staging"]},
    {"node_id": "creative-preflight", "role_id": "brand-creative", "depends_on": ["launch-evidence"], "optional": true, "run_when": "Run when final launch assets are required by the selected channels.", "objective": "Produce a revision-bound creative package with rights, accessibility, metadata, and exact hashes.", "output_contract": "result-envelope@2", "deliverable_contract": "creative-package@1", "allowed_write_roots": ["staging", "handoffs"]},
    {"node_id": "launch-package", "role_id": "product-marketing-positioning", "depends_on": ["launch-evidence", "product-readiness", "measurement-readiness", "search-preflight", "lifecycle-preflight", "creative-preflight"], "optional": false, "run_when": "always", "objective": "Assemble the supported narrative, readiness findings, channel sequence, risks, and explicit no-launch boundary.", "output_contract": "result-envelope@2", "deliverable_contract": "launch-readiness-package@1", "allowed_write_roots": ["positioning/packages", "staging", "handoffs"]},
    {"node_id": "governance-final", "role_id": "governance-reviewer", "depends_on": ["launch-package"], "optional": false, "run_when": "always", "objective": "Review the exact launch-readiness package and assets for truth, evidence, readiness, rights, authority, and no-publication compliance.", "output_contract": "result-envelope@2", "deliverable_contract": "governance-verdict@1", "allowed_write_roots": ["records/governance", "handoffs"]}
  ],
  "final_product": {"producer_node": "launch-package", "contract": "launch-readiness-package@1", "supporting_contracts": ["evidence-packet@1", "funnel-diagnosis@1", "measurement-plan@1", "discovery-package@1", "lifecycle-plan@1", "creative-package@1"]},
  "parallelism": {"max_concurrent_workhorses": 2, "only_independent_nodes": true},
  "failure_policy": {"dependent_nodes": "blocked-or-skipped", "independent_nodes": "may-continue", "ambiguous_result": "needs_attention-no-blind-retry", "semantic_revisions": 2},
  "terminal_review": {"governance_node": "governance-final", "governance_contract": "governance-verdict@1", "required_governance_result": "pass", "review_item_contract": "outbox-review-item@1", "terminal_state": "review_ready", "human_actions": ["approve", "decline", "note"], "external_side_effects": false, "may_publish": false}
}
